{
  "lang": "en",
  "sejarah_title": "History",
  "sejarah_content": "**CAAIP (Community of Alumni Akademi Angkatan Indonesia Puspenerbal)** is an organization that brings together alumni of the Indonesian Transportation Academy Puspenerbal.\n\nEstablished with the spirit of togetherness and kinship, CAAIP aims to strengthen the bonds between alumni and make positive contributions to the advancement of the institution and the nation.\n\nThrough various activities and programs, CAAIP continues to strive to maintain and improve the quality of alumni and provide support for institutional development.",
  "visi_title": "Vision",
  "visi_content": "To become a solid, professional alumni organization that actively contributes to the development of Indonesia's transportation and maritime sectors.",
  "misi_title": "Mission",
  "misi_content": "1. Strengthen friendship and kinship among alumni\n2. Improve alumni competence and professionalism\n3. Make tangible contributions to institutional advancement\n4. Support the development of national transportation and maritime sectors\n5. Build mutually beneficial cooperation networks",
  "struktur_title": "Organizational Structure",
  "struktur_image": "",
  "struktur_content": "The CAAIP organizational structure consists of:\n\n- **General Chairman**\n- **Vice Chairman**\n- **Secretary**\n- **Treasurer**\n- **Divisions**\n\nComplete information will be updated through CMS."
}
