{
  "visi_title": "Visi",
  "struktur_title": "Struktur Organisasi",
  "visi_content": "Menjadi organisasi alumni yang solid, profesional, dan berkontribusi aktif dalam pembangunan transportasi dan maritim Indonesia.",
  "struktur_content": "Struktur organisasi CAAIP terdiri dari:\n\n* **Ketua Umum**\n* **Wakil Ketua**\n* **Sekretaris**\n* **Bendahara**\n* **Bidang-bidang**",
  "struktur_image": "",
  "sejarah_title": "Sejarah",
  "sejarah_content": "**CAAIP (Community of Alumni Akademi Angkutan Indonesia Puspenerbal)** adalah organisasi yang menghimpun para alumni Akademi Angkutan Indonesia Puspenerbal.\n\nDidirikan dengan semangat kebersamaan dan kekeluargaan, CAAIP bertujuan untuk mempererat tali silaturahmi antar alumni, serta memberikan kontribusi positif bagi kemajuan institusi dan negara.\n\nMelalui berbagai kegiatan dan program, CAAIP terus berupaya menjaga dan meningkatkan kualitas alumni serta memberikan dukungan bagi perkembangan institusi.",
  "misi_title": "Misi",
  "misi_content": "1. Mempererat tali silaturahmi dan kekeluargaan antar alumni\n2. Meningkatkan kompetensi dan profesionalisme alumni\n3. Memberikan kontribusi nyata bagi kemajuan institusi\n4. Mendukung pembangunan sektor transportasi dan maritim nasional\n5. Membangun jaringan kerja sama yang saling menguntungkan",
  "lang": "id"
}
